{
  "version": 1,
  "server": {
    "host": "127.0.0.1",
    "port": 10101,
    "clientAuth": { "mode": "none", "tokenEnv": "AGENT_OPENCODEX_CLIENT_KEY" }
  },
  "defaults": {
    "provider": "openrouter",
    "model": "deepseek/deepseek-v4-flash-latest"
  },
  "providers": {
    "openrouter": {
      "type": "openai-chat",
      "baseUrl": "https://openrouter.ai/api/v1",
      "apiKeyEnv": "OPENROUTER_API_KEY",
      "models": ["deepseek/deepseek-v4-flash-latest"],
      "headers": {
        "HTTP-Referer": "${OPENROUTER_SITE_URL:-http://localhost}",
        "X-Title": "${OPENROUTER_APP_NAME:-Agent OpenCodex}"
      }
    }
  }
}
