{
  "$schema": "./config.schema.json",
  "version": 1,
  "server": {
    "host": "127.0.0.1",
    "port": 10101,
    "requestTimeoutMs": 300000,
    "heartbeatMs": 2000,
    "maxBodyBytes": 20000000,
    "clientAuth": {
      "mode": "none",
      "tokenEnv": "AGENT_OPENCODEX_CLIENT_KEY"
    }
  },
  "logging": {
    "level": "info",
    "json": false,
    "prompts": false,
    "file": "~/.agent-opencodex/logs/gateway.jsonl"
  },
  "continuation": {
    "enabled": true,
    "maxEntries": 256,
    "ttlMs": 21600000
  },
  "defaults": {
    "provider": "openrouter",
    "model": "deepseek/deepseek-v4-flash-latest"
  },
  "routes": {
    "coding-fast": [
      {
        "provider": "openrouter",
        "model": "deepseek/deepseek-v4-flash-latest"
      },
      {
        "provider": "ollama",
        "model": "qwen3-coder"
      }
    ]
  },
  "providers": {
    "openrouter": {
      "type": "openai-chat",
      "baseUrl": "https://openrouter.ai/api/v1",
      "apiKeyEnv": "OPENROUTER_API_KEY",
      "models": [
        "deepseek/deepseek-v4-flash-latest"
      ],
      "headers": {
        "HTTP-Referer": "${OPENROUTER_SITE_URL:-http://localhost}",
        "X-Title": "${OPENROUTER_APP_NAME:-Agent OpenCodex}"
      },
      "maxRetries": 2,
      "retryStatuses": [408, 409, 429, 500, 502, 503, 504]
    },
    "ollama": {
      "type": "openai-chat",
      "baseUrl": "http://127.0.0.1:11434/v1",
      "models": ["qwen3-coder"],
      "maxRetries": 0
    }
  }
}
